{"schemaVersion":"0.1.0","documentType":"adapter-request","profile":"patamaps-workspace-draft-1","sourceId":"urn:installed:source","namespace":"installed","config":{"adapter":"prisma","path":"/var/folders/tr/qmsqldfn59591rbflj14mc4r0000gn/T/patamaps-discovery-api-djyugila/outside.prisma"},"inputs":[{"receipt":{"path":"schema.prisma","digest":"sha256:f665542071415b310def1a39b640089917c34229007a3bc78e29d23f4b9316fa","byteLength":30},"content":"model Item {\n id String @id\n}\n"}],"invocationDigest":"sha256:0000000000000000000000000000000000000000000000000000000000000000","requestDigest":"sha256:1111111111111111111111111111111111111111111111111111111111111111"}